{
  "id": "telegram-resource",
  "name": "TG搜索",
  "version": "0.2.1",
  "description": "搜索 Telegram 频道，并实时监听指定频道的新消息，将 115 分享和 ed2k 直链资源提交到 CloudHub",
  "author": "Mediary",
  "homepage": "https://github.com/KyleYu2024/Mediary-Plugins/tree/plugins-v1.0.31/official/telegram-resource",
  "source": "https://github.com/KyleYu2024/Mediary-Plugins/tree/plugins-v1.0.31/official",
  "license": "MIT",
  "api_version": 1,
  "min_mediary_version": "2.5.4",
  "permissions": [
    "integrations:run",
    "settings:read"
  ],
  "artifacts": {
    "linux-amd64": {
      "url": "https://github.com/KyleYu2024/Mediary-Plugins/releases/download/plugins-v1.0.31/telegram-resource-v0.2.1-linux-amd64.tar.gz",
      "sha256": "4df3930bdeb2b27fb170d71aee6cd71aa7ffe95e0bf423a945dec567182757f8",
      "size": 6780093
    },
    "linux-arm64": {
      "url": "https://github.com/KyleYu2024/Mediary-Plugins/releases/download/plugins-v1.0.31/telegram-resource-v0.2.1-linux-arm64.tar.gz",
      "sha256": "e6bb3ffe4b11fc40f9869e749b2b41b54e46459815ebece9916ab17f940f65fb",
      "size": 6740307
    },
    "darwin-amd64": {
      "url": "https://github.com/KyleYu2024/Mediary-Plugins/releases/download/plugins-v1.0.31/telegram-resource-v0.2.1-darwin-amd64.tar.gz",
      "sha256": "92653b10e3c6323fb13aab9849a490d0811f3cee233a985d9c388f74305550bc",
      "size": 6390248
    },
    "darwin-arm64": {
      "url": "https://github.com/KyleYu2024/Mediary-Plugins/releases/download/plugins-v1.0.31/telegram-resource-v0.2.1-darwin-arm64.tar.gz",
      "sha256": "f0e9cdcf5436f050a2f542f1384264fedde5c05b0061667faf510da7b3c88c10",
      "size": 6119058
    }
  }
}
