{
  "id": "douban-coming",
  "name": "豆瓣将映",
  "version": "1.0.4",
  "description": "监控豆瓣即将开播电视剧，按想看人数筛选，提前创建订阅并发送开播提醒",
  "author": "schuck",
  "homepage": "https://github.com/Ladavian/Mediary-Community-Plugins/tree/main/plugins/douban-coming",
  "source": "https://github.com/Ladavian/Mediary-Community-Plugins",
  "license": "GPL-3.0-only",
  "api_version": 1,
  "min_mediary_version": "0.8.8",
  "permissions": [
    "catalog:read",
    "subscriptions:read",
    "subscriptions:write",
    "notifications:send"
  ],
  "artifacts": {
    "linux-amd64": {
      "url": "https://github.com/Ladavian/Mediary-Community-Plugins/releases/download/douban-coming-v1.0.4/douban-coming-1.0.4-linux-amd64.tar.gz",
      "sha256": "94f2b1590605c8e7601ef3bc57157424b7227b69f4e1398920970ca8e63f10c3",
      "size": 2982021
    },
    "linux-arm64": {
      "url": "https://github.com/Ladavian/Mediary-Community-Plugins/releases/download/douban-coming-v1.0.4/douban-coming-1.0.4-linux-arm64.tar.gz",
      "sha256": "8100aa33ce3c93bc78c319d612be0eb79d4a680fd68855ba1e067941855be0fb",
      "size": 2973827
    }
  }
}
