{
  "id": "douban-wish",
  "name": "豆瓣想看",
  "version": "1.0.1",
  "description": "同步一个或多个豆瓣用户最近标记的想看影视，识别 TMDB 后自动创建 Mediary 订阅",
  "author": "Mediary",
  "homepage": "https://github.com/KyleYu2024/Mediary-Plugins/tree/plugins-v1.0.44/official/douban-wish",
  "source": "https://github.com/KyleYu2024/Mediary-Plugins/tree/plugins-v1.0.44/official",
  "license": "GPL-3.0-only",
  "api_version": 1,
  "min_mediary_version": "0.7.7",
  "permissions": [
    "catalog:read",
    "subscriptions:read",
    "subscriptions:write"
  ],
  "artifacts": {
    "linux-amd64": {
      "url": "https://github.com/KyleYu2024/Mediary-Plugins/releases/download/plugins-v1.0.44/douban-wish-v1.0.1-linux-amd64.tar.gz",
      "sha256": "65e53257800e813941ee8cac69e77817be8c1ca6c63351700e965b1e0b8b37c6",
      "size": 3170601
    },
    "linux-arm64": {
      "url": "https://github.com/KyleYu2024/Mediary-Plugins/releases/download/plugins-v1.0.44/douban-wish-v1.0.1-linux-arm64.tar.gz",
      "sha256": "77ccdff9353979b8b686c70d846ab9a7b71278731693dd95c98893377654291d",
      "size": 3191342
    },
    "darwin-amd64": {
      "url": "https://github.com/KyleYu2024/Mediary-Plugins/releases/download/plugins-v1.0.44/douban-wish-v1.0.1-darwin-amd64.tar.gz",
      "sha256": "daa836b7118946ff017f2215c122e807d04a65ec4730a79e114bbfc0208fa639",
      "size": 2997529
    },
    "darwin-arm64": {
      "url": "https://github.com/KyleYu2024/Mediary-Plugins/releases/download/plugins-v1.0.44/douban-wish-v1.0.1-darwin-arm64.tar.gz",
      "sha256": "30b34104bf84b75be8752de6a3d48a03161d6a53328bce82166ee2efd5a3407b",
      "size": 2885478
    }
  }
}
