{
  "id": "pansou",
  "name": "盘搜",
  "version": "0.2.0",
  "description": "聚合搜索 115 分享、磁力与 ed2k 资源；115 分享和 ed2k 进入 FlowLink 转存整理，磁力提交 115 离线下载",
  "author": "Mediary",
  "homepage": "https://github.com/KyleYu2024/Mediary-Plugins/tree/plugins-v1.0.44/official/pansou",
  "source": "https://github.com/KyleYu2024/Mediary-Plugins/tree/plugins-v1.0.44/official",
  "license": "MIT",
  "api_version": 1,
  "min_mediary_version": "1.8.0",
  "permissions": [
    "integrations:run"
  ],
  "artifacts": {
    "linux-amd64": {
      "url": "https://github.com/KyleYu2024/Mediary-Plugins/releases/download/plugins-v1.0.44/pansou-v0.2.0-linux-amd64.tar.gz",
      "sha256": "05a56ce44f91ac601ffc8f166eaab4e8d713c03177bfc394d07b5b4ae54f9b9e",
      "size": 2322556
    },
    "linux-arm64": {
      "url": "https://github.com/KyleYu2024/Mediary-Plugins/releases/download/plugins-v1.0.44/pansou-v0.2.0-linux-arm64.tar.gz",
      "sha256": "3653996c4086146e11d23644cd7ba3b38c308f9d1ecd9a26a4c994571d642c25",
      "size": 2324359
    },
    "darwin-amd64": {
      "url": "https://github.com/KyleYu2024/Mediary-Plugins/releases/download/plugins-v1.0.44/pansou-v0.2.0-darwin-amd64.tar.gz",
      "sha256": "19ee39d848984bf3dd21c4df67e1555b9138630a25bf5715e2dfa861211fcb50",
      "size": 2202404
    },
    "darwin-arm64": {
      "url": "https://github.com/KyleYu2024/Mediary-Plugins/releases/download/plugins-v1.0.44/pansou-v0.2.0-darwin-arm64.tar.gz",
      "sha256": "3dec97f7307bd525634d65b1f5d205cd81d1ac8cd566bb22c123fa15a6d1e2c8",
      "size": 2125998
    }
  }
}
