{
  "id": "maoyan-rank",
  "name": "猫眼榜单订阅",
  "version": "0.2.3",
  "description": "定时读取猫眼榜单，解析 TMDB 后自动创建 Mediary 订阅",
  "author": "Mediary",
  "homepage": "https://github.com/KyleYu2024/Mediary-Plugins/tree/plugins-v1.0.42/official/maoyan-rank",
  "source": "https://github.com/KyleYu2024/Mediary-Plugins/tree/plugins-v1.0.42/official",
  "license": "MIT",
  "api_version": 1,
  "min_mediary_version": "0.7.7",
  "permissions": [
    "catalog:read",
    "subscriptions:read",
    "subscriptions:write"
  ],
  "artifacts": {
    "linux-amd64": {
      "url": "https://github.com/KyleYu2024/Mediary-Plugins/releases/download/plugins-v1.0.42/maoyan-rank-v0.2.3-linux-amd64.tar.gz",
      "sha256": "5e1ab5490d951706cad76a9641fe8aaa63c3a0947c433f24ec3f93af22fe9bb5",
      "size": 3120866
    },
    "linux-arm64": {
      "url": "https://github.com/KyleYu2024/Mediary-Plugins/releases/download/plugins-v1.0.42/maoyan-rank-v0.2.3-linux-arm64.tar.gz",
      "sha256": "a8b8a53ee60759173ab554ae4056d3a494bbdabded6779f75c5ab4bb4f529911",
      "size": 3125177
    },
    "darwin-amd64": {
      "url": "https://github.com/KyleYu2024/Mediary-Plugins/releases/download/plugins-v1.0.42/maoyan-rank-v0.2.3-darwin-amd64.tar.gz",
      "sha256": "f480d539321c03e6ebef9ba0fef8a3bd7b8f961ff1127c67e2da767f59f8afb3",
      "size": 2944397
    },
    "darwin-arm64": {
      "url": "https://github.com/KyleYu2024/Mediary-Plugins/releases/download/plugins-v1.0.42/maoyan-rank-v0.2.3-darwin-arm64.tar.gz",
      "sha256": "3b9ea1f31274f535b9b546904e91ba44a835012a87d3fd632951a4067d911cdf",
      "size": 2824392
    }
  }
}
