{
  "id": "115-checkin",
  "name": "115 签到",
  "version": "0.1.3",
  "description": "使用独立配置的 115 Cookie 执行安卓端积分签到，并可定时发送结果通知",
  "author": "Mediary",
  "homepage": "https://github.com/KyleYu2024/Mediary-Plugins/tree/plugins-v1.0.42/official/115-checkin",
  "source": "https://github.com/KyleYu2024/Mediary-Plugins/tree/plugins-v1.0.42/official",
  "license": "MIT",
  "api_version": 1,
  "min_mediary_version": "1.8.0",
  "permissions": [
    "notifications:send"
  ],
  "artifacts": {
    "linux-amd64": {
      "url": "https://github.com/KyleYu2024/Mediary-Plugins/releases/download/plugins-v1.0.42/115-checkin-v0.1.3-linux-amd64.tar.gz",
      "sha256": "f4f6865f96368d42cf26186c9bf30b72edf786c24cf70372ce346ad94d1045b1",
      "size": 2329010
    },
    "linux-arm64": {
      "url": "https://github.com/KyleYu2024/Mediary-Plugins/releases/download/plugins-v1.0.42/115-checkin-v0.1.3-linux-arm64.tar.gz",
      "sha256": "31659efa38d8fc5d25b1efb98be28a6c3bc6ffebfc28058b500e4e60df80aa67",
      "size": 2341415
    },
    "darwin-amd64": {
      "url": "https://github.com/KyleYu2024/Mediary-Plugins/releases/download/plugins-v1.0.42/115-checkin-v0.1.3-darwin-amd64.tar.gz",
      "sha256": "14a7e74a23c8b017b7e894ab14a81519c6b915df97462a22f10f115d5ddbeb12",
      "size": 2206462
    },
    "darwin-arm64": {
      "url": "https://github.com/KyleYu2024/Mediary-Plugins/releases/download/plugins-v1.0.42/115-checkin-v0.1.3-darwin-arm64.tar.gz",
      "sha256": "efb51d1371cd7cdee4c1159c49502fa6690581da9c58112718e9129b4c422ff1",
      "size": 2141180
    }
  }
}
