{
  "id": "dockercopilot-helper",
  "name": "DC 助手",
  "version": "1.0.10",
  "description": "连接 Docker Copilot，检查和自动更新容器、清理未使用的无标签镜像并备份容器配置，并发送系统通知",
  "author": "schuck",
  "homepage": "https://github.com/Ladavian/Mediary-Community-Plugins",
  "source": "https://github.com/Ladavian/Mediary-Community-Plugins",
  "api_version": 1,
  "min_mediary_version": "0.7.7",
  "permissions": [
    "notifications:send"
  ],
  "artifacts": {
    "linux-amd64": {
      "url": "https://github.com/Ladavian/Mediary-Community-Plugins/releases/download/dockercopilot-helper-v1.0.10/dockercopilot-helper-1.0.10-linux-amd64.tar.gz",
      "sha256": "a7982afc482185d7e7fc4363382b7e7c16425069f3e2a21ea4e4d424a572b6b3",
      "size": 2282847
    },
    "linux-arm64": {
      "url": "https://github.com/Ladavian/Mediary-Community-Plugins/releases/download/dockercopilot-helper-v1.0.10/dockercopilot-helper-1.0.10-linux-arm64.tar.gz",
      "sha256": "3812da8f92c577c88d8d67397e8fbe080258d58826d80a9ba1ffe99cd81dee9c",
      "size": 2279021
    }
  }
}
