{
  "id": "author.plugin-name",
  "name": "插件名称",
  "version": "1.0.0",
  "description": "一句话说明插件用途",
  "author": "作者名称",
  "homepage": "https://github.com/author/plugin-name",
  "source": "https://github.com/author/plugin-name",
  "license": "MIT",
  "api_version": 1,
  "min_mediary_version": "0.8.0",
  "permissions": [],
  "artifacts": {
    "linux-amd64": {
      "url": "https://github.com/author/plugin-name/releases/download/v1.0.0/plugin-linux-amd64.tar.gz",
      "sha256": "0000000000000000000000000000000000000000000000000000000000000000"
    }
  }
}
